,Unnamed: 0,cluster,tweets,timestamp
186,186,0,حشر دن عجب دیکھ زلف لہرا ﷺ تاقیامت اک اورقیامت ,2022-04-10 20:10:08
187,187,3,تحریک انصاف امیر غریب ,2022-04-10 20:10:08
188,188,0,غیرت مند خوددرا لیڈر ہجوم قوم بنا خان صاحب اللہ راضی پو آپکا نگہبا,2022-04-10 20:10:08
189,189,5,کراچی والو عظیم لوگ امپورٹڈحکومتنامنظور,2022-04-10 20:10:08
190,190,5,عرض سیاست فیصلہ عدالت کوشش تباہ کن سمجھ آج باہر نکلیں عو,2022-04-10 20:10:08
191,191,0,عمران خان غلط ٹھیک باقی ا س بہتر ,2022-04-10 20:10:08
192,192,0,اب سمجھ آخر رگیدا قوم فرد دیکھ مینڈیٹ نقب زنی آج,2022-04-10 20:10:08
193,193,5,حساب لوگ خان سپورٹ باہر عاشقان جی ایچ کیو تحریک لبیک جلدی آڈر مل ,2022-04-10 20:10:08
194,194,0,سنو رونگٹہ کھڑے پاکستان کراچی عوام عمران ,2022-04-10 20:10:08
195,195,0,پاک فوج نوجوان زندگی قربانی دھرتی ماں دفاع فوج سربراہ شخص سیلوٹ مارا جلس باجوہ کتا ہائے ہائے نعرہ اپکو دکھ محب وطن پاکستانی ناطے بات دکھ ,2022-04-10 20:10:08
196,196,0,ایرانی انقلاب پاکستان دیکھ پوری دنیا پاکستان عظیم ایشیائی لیڈر ابھر دیکھ ,2022-04-10 20:10:09
197,197,0,میڈیا بلیک آوٹ کروا اکھاڑ الٹا مزید نقاب آج جنریشن معلومات کیلئے آپکا جیونیوز محتاج ,2022-04-10 20:10:09
198,198,0,شیطان خان خاطر احتجاج ڈب مر رسول اللہ عزت گھر نکل کل قبر رسول اللہ منہ دکھاؤ ,2022-04-10 20:10:09
199,199,0,وقت دیکھ ایگنور پے سیریر ای ہن پحتو حسابباقیہے,2022-04-10 20:10:09
200,200,0,پورا پاکستان مظاہرے ادارہ بدنام فرق مسلط غلام سیاسی,2022-04-10 20:10:09
201,201,0,امن جنگ کپتان سنگ ,2022-04-10 20:10:08
202,202,1,لوگ باہر لوگ نکل جلسا ملک باہر بغیر لیڈر خود خان باہرایگا حال نام شر,2022-04-10 20:10:09
203,203,0,شمع فروزاں آندھی ڈراتا شمع فروزاں پروانہ ہزار امپورٹڈگورمنٹنامنظور,2022-04-10 20:10:09
204,204,1,لوگ باہر لوگ نکل جلسا ملک باہر بغیر لیڈر خود خان باہرایگا حال نام شر,2022-04-10 20:10:09
205,205,0,الحمدللہ ھم کراچی بھکاری ,2022-04-10 20:10:09
206,206,0,کھانا کھا شرمو امپورٹڈحکومتنامنظور,2022-04-10 20:10:09
207,207,0,عمران خان پاکستان پہلا وزیر اعظم خلاف عدم اعتماد کامیاب ئی اسکی انفرادیت باقی کرپشن,2022-04-10 20:10:09
208,208,4,ملک بھر ساختہ لوگ سڑک پہ نکل حیرت ٹی وی چینل کم دکھ لاہورکی کیفیت ش,2022-04-10 20:10:09
209,209,0,آج جہلم عوام سمندر امڈ پاکستان موجود بیرونی ایجنٹ خلاف سڑک وزیراعظم عمران خان انشاءال,2022-04-10 20:10:09
210,210,1,لوگ باہر لوگ نکل جلسا ملک باہر بغیر لیڈر خود خان باہرایگا حال نام شر,2022-04-10 20:10:09
211,211,0,اتنی دن باجوہ ندیم وقت سمجھ آگئ قوم عمران خان ساتھ باجوے نیبو کیس,2022-04-10 20:10:10
212,212,0,چینل اینکرز رولنگ مسترد عدم منظور اتنا زور ڈائپر بھر اندازہ ا,2022-04-10 20:10:10
213,213,1,لوگ باہر لوگ نکل جلسا ملک باہر بغیر لیڈر خود خان باہرایگا حال نام شر,2022-04-10 20:10:10
214,214,1,لوگ باہر لوگ نکل جلسا ملک باہر بغیر لیڈر خود خان باہرایگا حال نام شر,2022-04-10 20:10:10
215,215,0,خان قوم سوچ سوچ سلامت شعور شعور سلامت جذبہ جذبہ سلامت عمران خان جیت,2022-04-10 20:10:10
216,216,0,پارا چنار تعلق مزدور رحمان علی سخت گرمی سنسان سڑک اکیلا رو رو یوم سیاہ منا آپکو ہ,2022-04-10 20:10:10
217,217,3,ب ھکاری باپ پاکستانی ,2022-04-10 20:10:10
218,218,0,دنیا کونا مورچہ سنبھالو خودداری جنگ لڑو غدار پوچھو پاک,2022-04-10 20:10:10
219,219,0,دیکھ آنکھ کھول دیکھ بےشرم جاہل سمجھ عوام اب بتائیے وزیراعظم ایماندار,2022-04-10 20:10:10
220,220,0,وزیر اعظم ہاؤس چھوڑا پہلےمیرے کپتان میڈیا اینکرز سوال بتاؤ عوام علاوہ کوئ میر,2022-04-10 20:10:10
221,221,1,لوگ باہر لوگ نکل جلسا ملک باہر بغیر لیڈر خود خان باہرایگا حال نام شر,2022-04-10 20:10:10
222,222,0,ٹائم عوام سن گوا جوش آیا پائے,2022-04-10 20:10:10
223,223,0,پرامن احتجاج جماعت بنیادی حق پی ٹی مظاہرہ کووریج روک غلط کام پی ٹی کام ص,2022-04-10 20:10:10
224,224,0,ن لیگ پالتو مختلف ادارہ بیٹھ پٹواری وقت دیکھانا شروع ,2022-04-10 20:10:10
225,225,0,بیغیرت قیادت روشن م ستقبل امید دیوانہ خواب ,2022-04-10 20:10:11
226,226,3,ب ھکاری باپ پاکستانی ,2022-04-10 20:10:11
227,227,1,لوگ باہر لوگ نکل جلسا ملک باہر بغیر لیڈر خود خان باہرایگا حال نام شر,2022-04-10 20:10:11
228,228,1,لوگ باہر لوگ نکل جلسا ملک باہر بغیر لیڈر خود خان باہرایگا حال نام شر,2022-04-10 20:10:11
229,229,5,شروعات حریت پاسپاں خود نکل عالم سازش والو ہوش ناخن ,2022-04-10 20:10:11
230,230,1,لوگ باہر لوگ نکل جلسا ملک باہر بغیر لیڈر خود خان باہرایگا حال نام شر,2022-04-10 20:10:11
231,231,5,رک جائیے خان صاحب اسمبلی استعفا خود کشی مشورہ معلومات غلط شائد ایجنٹ ,2022-04-10 20:10:11
232,232,0,للکارا غلطی بیٹھ دیکھ عوام کہاں پہنچا امپورٹڈحکومتنامنظور,2022-04-10 20:10:11
233,233,0,اسما شوکت مطابق پیٹرول ڈلوایا پیٹرول پمپ پیس وائسرا شہبازشریف ,2022-04-10 20:10:11
234,234,0,جناب آج ٹویٹ شہر حق نکلا جواب ,2022-04-10 20:10:12
235,235,0,بیچارا بات آج آپکی باری کل کل وقت بدل دیر اللہ عاجزی پسند مشکل خوشی حال عقل کام چاہیے,2022-04-10 20:10:12
236,236,0,پہاڑی علاقہ آدھی رات اتنی تعداد لوگ نکالنا کمال قسم دیر آواز,2022-04-10 20:10:12
237,237,0,شمع فروزاں آندھی ڈراتا شمع فروزاں پروانہ ہزار امپورٹڈگورمنٹنامنظور,2022-04-10 20:10:12
238,238,0,السلام علیکم حامد میر صاحب امید خیریت دیر عمران خان پرانی تصویر شئیر اچانک ,2022-04-10 20:10:12
239,239,0,شہباز شریف کاغذہ نامزدگی چیلنج چاہئے ضمانت ملزم شخص وقت مجرم بن ,2022-04-10 20:10:12
240,240,0,پاگل ھے بڈھا ڈاکو ساتھ ھے پنجاب نام ھے اسکا پرویز الہی,2022-04-10 20:10:12
241,241,0,خیال ھے چاچو آٹھ جماعت مل اتنا ہجوم اکٹھا کرسکت جتنا پورا ملک جگہ جگہ عمران خان کال اکٹھا امپورٹڈحکومتنامنظور,2022-04-10 20:10:12
242,242,1,لوگ باہر لوگ نکل جلسا ملک باہر بغیر لیڈر خود خان باہرایگا حال نام شر,2022-04-10 20:10:12
243,243,2,راولپنڈی لوگ سڑک پہ چھتہ پاکستان شہر سمیت دنیا بھر عمران خاں حق مظاہرے حالات م,2022-04-10 20:10:12
244,244,0,دوسرا طاقت بن اسوقت لاہیک کنجوسی مت سلیبرٹی مت بن فالو جاہیں مقصد تحت مریم نواز ,2022-04-10 20:10:12
245,245,1,لوگ باہر لوگ نکل جلسا ملک باہر بغیر لیڈر خود خان باہرایگا حال نام شر,2022-04-10 20:10:12
246,246,0,یوتھیو سچا خان ساتھ کھڑے کل امریکن ایمبیسی گھیراو ساتھ آجاؤ,2022-04-10 20:10:13
247,247,0,شمع فروزاں آندھی ڈراتا شمع فروزاں پروانہ ہزار امپورٹڈگورمنٹنامنظور,2022-04-10 20:10:13
248,248,0,حال محب وطن بن حامد میر صافی حسین حقانی میڈیا سٹریٹیجی الیکٹرانک میڈیا پرو لوگو,2022-04-10 20:10:13
249,249,0,پہاڑی علاقہ آدھی رات اتنی تعداد لوگ نکالنا کمال قسم دیر آواز,2022-04-10 20:10:13
250,250,1,لوگ باہر لوگ نکل جلسا ملک باہر بغیر لیڈر خود خان باہرایگا حال نام شر,2022-04-10 20:10:13
251,251,0,کراچی راشد منہاس روڈ سرگودھا کچہری پل لاہور لبرٹی چوک سیالکوٹ قلب راولپنڈی مری روڈ اسلام آباد زیرو پوائینٹ عوام جم غفیر ٹی وی چینل کور ص م ب ك م عمرانہمتمارےسں امپورٹڈحکومتنامنظور,2022-04-10 20:10:13
252,252,0,پہاڑی علاقہ آدھی رات اتنی تعداد لوگ نکالنا کمال قسم دیر آواز,2022-04-10 20:10:13
253,253,0,    ,2022-04-10 20:10:13
254,254,0,عمران خان پاکستان پہلا وزیر اعظم خلاف عدم اعتماد کامیاب ئی اسکی انفرادیت باقی کرپشن,2022-04-10 20:10:13
255,255,0,ن لیگ پالتو مختلف ادارہ بیٹھ پٹواری وقت دیکھانا شروع ,2022-04-10 20:10:13
256,256,5,حساب لوگ خان سپورٹ باہر عاشقان جی ایچ کیو تحریک لبیک جلدی آڈر مل ,2022-04-10 20:10:13
257,257,0,ارادہ پختہ نظر خدا تلاطم خیز موج گھبرایا ,2022-04-10 20:10:13
258,258,0,آج سن دل باغ باغ چوکیدار چور اب چوکیدار چاہیے سیاست انگل تیلا پرہیز ملکی قیادت فیصلہ عوام ووٹ کارکردگی پسند اگلا الیکشن باہر مزید نعرہ چوکیدار چیلا ,2022-04-10 20:10:13
259,259,0,پاکستانی عوام سوموٹو انصاف دلالہ بج عدالت کھلوانہ بھکاری اپوزیشن واضح پیغام امریکا پھٹو لوگ بن عوام ,2022-04-10 20:10:13
260,260,0,خطرناک کیفیت شخصیت سحر اتنا مبتلا آئین قانون ضابطہ حتی مہذب گفتگو بھو,2022-04-10 20:10:13
261,261,0,غلامی کام شمشیر تدبیر ذوق یقین پیدا کٹ زنجیر اقبال,2022-04-10 20:10:13
262,262,0,شہباز شریف کاغذہ نامزدگی منظور ایف آئ پہلا آرڈر کل وکیل ٹیم شہباز شریف مقدمہ م,2022-04-10 20:10:14
263,263,3,ب ھکاری باپ پاکستانی ,2022-04-10 20:10:14
264,264,0,عمران خان حکومت بات واضح لیڈرشپ تاجر چننا خوشحال ,2022-04-10 20:10:14
265,265,0,نیازی غنڈ جگہ سٹیج بنا جہاں عام پبلک گزر جلسی گراونڈ بہتر پوری رات پھیٹتا ساتھ ہلکا ہلکا قریبی کھڑے شخص چار تھپڑ مار رو دن رو دل ہلکا جائے ,2022-04-10 20:10:14
266,266,0,بلیئن ٹری سونامی سکینڈل ارب درخت ایماندار نیازی کرپٹ حکومت پچھلا سات سال عوام غلط بیانی اربو,2022-04-10 20:10:14
267,267,5,مزا بات خان بھر نکلا سوچو خود نکل نظارہ امپورٹڈحکومتنامنظور,2022-04-10 20:10:14
268,268,0,اقتدار نشے فرانس دلالی تحریک لبیک پاکستان نہتے کارکن سیدھی گولی چلا آج ذلیل ل,2022-04-10 20:10:14
269,269,3,سمجھ بکا میڈیا روک انقلاب روک غصہ انصاف خلاف احتجاج میڈیا کوریج ,2022-04-10 20:10:14
270,270,0,عمران خان پاکستان پہلا وزیر اعظم خلاف عدم اعتماد کامیاب ئی اسکی انفرادیت باقی کرپشن,2022-04-10 20:10:14
271,271,0,فاروق بندیال اداکارہ شبنم ریپ بھائی عطا بندیال پاکستان غیرت ناموس پامال ب,2022-04-10 20:10:15
272,272,3,تحریک انصاف امیر غریب ,2022-04-10 20:10:15
273,273,0,خانتیراایکاشارہحاضرلہوہمارا شیر زخمی کتا مدد خان ببرشیر اکیلا کتا لڑا ,2022-04-10 20:10:15
274,274,2,راولپنڈی لوگ سڑک پہ چھتہ پاکستان شہر سمیت دنیا بھر عمران خاں حق مظاہرے حالات م,2022-04-10 20:10:15
275,275,0,مرمت ,2022-04-10 20:10:15
276,276,4,ملک بھر ساختہ لوگ سڑک پہ نکل حیرت ٹی وی چینل کم دکھ لاہورکی کیفیت ش,2022-04-10 20:10:15
277,277,1,لوگ باہر لوگ نکل جلسا ملک باہر بغیر لیڈر خود خان باہرایگا حال نام شر,2022-04-10 20:10:15
278,278,0,خودار پاکستانی آواز بھکاری باپ شو باز امپورٹڈحکومتنامنظور,2022-04-10 20:10:15
279,279,0,بہ وڈی غلطی بیٹھ سرکار بہ وڈی سزا یافتہ بھکاری وزیر اعظم بنا ضد ڈوبا ڈوب,2022-04-10 20:10:15
280,280,0,باپ بیٹی پیار چمچہ گیری ,2022-04-10 20:10:15
281,281,5,شروعات حریت پاسپاں خود نکل عالم سازش والو ہوش ناخن ,2022-04-10 20:10:15
282,282,4,ملک بھر ساختہ لوگ سڑک پہ نکل حیرت ٹی وی چینل کم دکھ لاہورکی کیفیت ,2022-04-10 20:10:15
283,283,0,آنس دیکھ اک اک آنس بدل انشاءالل ہ حسابباقیہے,2022-04-10 20:10:15
284,284,3,تحریک انصاف امیر غریب ,2022-04-10 20:10:15
285,285,0,پیدا ہ وا پاکستان آزاد پاکستان,2022-04-10 20:10:16
286,286,0,صحت کارڈ خان ساتھ ختم کرائم منسٹر کرائم کارڈ نکال بنک فراڈ آسان ,2022-04-10 20:10:16
287,287,0,عوام ایکشن دیکھ مونس ال آج پرویز ال دیکھ بچا ناں,2022-04-10 20:10:16
288,288,0,خان صاحب قوم روشن وقت سوئیں انصاف پاکستان حقیقی,2022-04-10 20:10:16
289,289,0,لوگ انصاف گالی ادارہ برا بھلا سارا شہر ویڈیوز منگواؤ ادارہ د,2022-04-10 20:10:16
290,290,0,پوری قوم شوباز شریف جواب بھکاری باپ امپورٹڈحکومتنامنظور,2022-04-10 20:10:16
291,291,3,تحریک انصاف امیر غریب ,2022-04-10 20:10:16
292,292,0,سرکار ٹوئٹ پڑھ لکھ وطناں غدار غیر آئینی کام جماعت کالعدم قرار چاہیے آئین خلاف روک ضرورت ,2022-04-10 20:10:16
293,293,0,بلیئن ٹری سونامی سکینڈل ارب درخت ایماندار نیازی کرپٹ حکومت پچھلا سات سال عوام غلط بیانی اربو,2022-04-10 20:10:16
294,294,0,الل ہ الل ہ دل پاوا جھلی مینوں سوہنے بلایا مدینہ آں حسابباقیہے,2022-04-10 20:10:16
295,295,0,پاکستانی عوام ازخود نوٹس جناب گیے دل دڑکھ رھا عوام سمندر دیکھ جناب ہوش ب,2022-04-10 20:10:16
296,296,3,ب ھکاری باپ پاکستانی ,2022-04-10 20:10:16
297,297,0,میڈیا بلیک آوٹ کروا اکھاڑ الٹا مزید نقاب آج جنریشن معلومات کیلئے آپکا جیونیوز محتاج ,2022-04-10 20:10:16
298,298,5,مائی لارڈ ڈیئر سر باہر نکلیں دیکھ عمران خان نکال پاکستانی دل ,2022-04-10 20:10:16
299,299,0,انشاء اللہ تعال ی تین چیلنج پورا ,2022-04-10 20:10:16
300,300,0,آج عہد پاکستان حفاظت خون آخری قطرہ پاکستان حفاظت غلامی مانتے غلام رب پیارا نبی غلام ایمان والو اکٹھا دشمنا نستو نابود کردو,2022-04-10 20:10:16
301,301,0,مرمت ,2022-04-10 20:10:16
302,302,0,لاہور فیصلہ س اگلا الیکشن لاہور سمیت پنجاب عمران خان تہائی اکثریت نکل انشاءال,2022-04-10 20:10:17
303,303,0,اللہ قسم ساری زندگی پتا حسین علیہ السلام عمران خان ساتھ ساری کربلہ سمجھ شخص عمران کردار حسین یزید مخالف امپورٹڈگورنمنٹنامنظور امپورٹڈحکومتنامنظور,2022-04-10 20:10:17
304,304,0,استعفا غلطی حماقت اسمبلی دبا چیز عوامی احتجاج پلس پوائنٹ ,2022-04-10 20:10:17
305,305,0,لوگ انصاف گالی ادارہ برا بھلا سارا شہر ویڈیوز منگواؤ ادارہ د,2022-04-10 20:10:17
306,306,3,سمجھ بکا میڈیا روک انقلاب روک غصہ انصاف خلاف احتجاج میڈیا کوریج ,2022-04-10 20:10:17
307,307,0,والدہ ڈھائی سال بستر مرگ اورسال والد شدید بیماری شکار ڈھائی سال میراملنا جلنا دوست,2022-04-10 20:10:17
308,308,3,اتنا احتجاج میڈیا دکھ ,2022-04-10 20:10:17
309,309,0,احتجاج رد عمل مکروہ عمل باجوہ صاحب قوم فیصلہ سنا خدارا ادارہ وقار خاک مت ملاؤ استعفی دفعہ امریکہ باجوہاستعفیدو امپورٹڈحکومتنامنظور,2022-04-10 20:10:17
310,310,0,اسمبلی استعفا تحریک انصاف سیاسی بلنڈر خالی ہونیوالےحل ضمنی الیکشن جائینگے تحریک انصا,2022-04-10 20:10:17
311,311,0,شہباز شریف کاغذہ نامزدگی چیلنج چاہئے ضمانت ملزم شخص وقت مجرم بن ,2022-04-10 20:10:17
312,312,5,چراغ گل لوگ اب میاں مٹھو بن میڈیا ایڈورٹائزمنٹ قوم لوگ م,2022-04-10 20:10:17
313,313,0,سنو رونگٹہ کھڑے پاکستان کراچی عوام عمران ,2022-04-10 20:10:17
314,314,0,بہ وڈی غلطی بیٹھ سرکار بہ وڈی سزا یافتہ بھکاری وزیر اعظم بنا ضد ڈوبا ڈوب,2022-04-10 20:10:17
315,315,0,عمران خان حکومت ختم اسلام قرآن پاک توہین بدبخت خوشی ملاحظہ کیجئے آخر وجہ قرآن ا,2022-04-10 20:10:17
316,316,0,چمچا جی دن انکل اقتدار یاد لوگ میڈیا تحریک لبیک پاکستان کوریج ,2022-04-10 20:10:18
317,317,0,شمع فروزاں آندھی ڈراتا شمع فروزاں پروانہ ہزار امپورٹڈگورمنٹنامنظور,2022-04-10 20:10:18
318,318,0,معلومات بنیاد پہ عرض نومبر چیف آف آرمی سٹاف جنرل قمر جاوید باجوہ سبکدوش معلومات بن,2022-04-10 20:10:18
319,319,0,عمران خان رخصت اب میڈیا خصوصا چینلز خوداحتسابی ضرور کہاں کہاں حب عمران کہاں کہاں بغض,2022-04-10 20:10:18
320,320,0,لعنت شاہین وار جنریشن میزائل بنا فائدہ ٹیکس پالا کاروبار بنا زمیں جرنیل بانٹ منتخب حکومت دھمکی گری ایجنسی دلا سوئے اصل اب پیسہ کاروبار پیارا بوجھ ,2022-04-10 20:10:18
321,321,5,عمران خان بغیر اتنی تعداد عوام نکل عمران خان صاحب خود نکل منظر امپورٹڈحکومت,2022-04-10 20:10:18
322,322,0,بیغیرتو ذندہ پاکستان اعلی غدارو پاکستان مختلف شہر تصاویر,2022-04-10 20:10:18
323,323,0,پوری قوم شوباز شریف جواب بھکاری باپ امپورٹڈحکومتنامنظور,2022-04-10 20:10:18
324,324,0,بیغیرت قیادت روشن م ستقبل امید دیوانہ خواب ,2022-04-10 20:10:18
325,325,0,پرامن احتجاج جماعت بنیادی حق پی ٹی مظاہرہ کووریج روک غلط کام پی ٹی کام ص,2022-04-10 20:10:18
326,326,0,چینل اینکرز رولنگ مسترد عدم منظور اتنا زور ڈائپر بھر اندازہ ا,2022-04-10 20:10:19
327,327,0,خودار پاکستانی آواز بھکاری باپ شو باز امپورٹڈحکومتنامنظور,2022-04-10 20:10:19
328,328,4,ملک بھر ساختہ لوگ سڑک پہ نکل حیرت ٹی وی چینل کم دکھ لاہورکی کیفیت ش,2022-04-10 20:10:19
329,329,5,عوام اب غیرت دکھانی غدار بائیکاٹ انکا گھر نکلنا محال کردیں گور ملک غدار لوگ,2022-04-10 20:10:19
330,330,0,چیرمین پاکستان تحریک انصاف عمران خان زیر صدارت کل بروز سوموار تحریک انصاف پارلیمانی پارٹی اجلاس انشاء,2022-04-10 20:10:19
331,331,0,پاسپورٹ جلا پاکستان بیغیرت زاانی چپیڑ پڑ گئ اج لندن بیٹھ ریمیٹنس پ,2022-04-10 20:10:19
332,332,0,سنو رونگٹہ کھڑے پاکستان کراچی عوام عمران ,2022-04-10 20:10:19
333,333,0,پاکستانی دل خوش اپ اج پوری دنیا پاکستان شہر احتجاج ریلی دیکھ یقین خان تہا ٸ,2022-04-10 20:10:19
334,334,0,سرکار خاتم النبینﷺ عزت ناموس دین اسلام تحفظ پوری دنیا تسلیم کروا عمران خان مقبولیت آج پوری دنیا دیکھ ساری دنیا میڈیا عوام سمندر براہ راست دکھ عمران عزت رب مبارک امپورٹڈحکومتنامنظور,2022-04-10 20:10:19
335,335,0,ہائے قربان جاوں آذادی میڈیا بات آج تحریک انصاف ملک گیر مظاہرہ کالعدم تنظیم ,2022-04-10 20:10:19
336,336,0,اندھا نظر ,2022-04-10 20:10:19
337,337,0,عمران خان ہتھیلی جان ہتھیلی تھوڑی عمران خان نکال جڑ کھوکھلی چک تمکو اندازہ,2022-04-10 20:10:19
338,338,0,رات سوشل میڈیا کریک ڈاؤن شروع سالیو تاڈی نسلاں وی ہیرا منڈی وچ نچن گئیاں پی ٹی سوشل میڈی,2022-04-10 20:10:19
339,339,1,لوگ باہر لوگ نکل جلسا ملک باہر بغیر لیڈر خود خان باہرایگا حال نام شر,2022-04-10 20:10:19
340,340,3,تحریک انصاف امیر غریب ,2022-04-10 20:10:19
341,341,0,یزید جیت مطلب حسین ہار برحق کےلیے اکثریت درکار بہادر اکیلا جیت شجاعت ,2022-04-10 20:10:20
342,342,5,مائی لارڈ ڈیئر سر باہر نکلیں دیکھ عمران خان نکال پاکستانی دل ,2022-04-10 20:10:20
343,343,0,بھارتی اپوزیشن لیڈر راہول گاندھی پاکستانی طنز ٹویٹ لکھ ھـے نریندرمودی قوم جواب پاکستان لڑ کیلیے ارب ڈالر مہنگہ ترین ہتھیار خریدہ جبکہ ارب ڈالر کم پورا پاکســتان خرید جاسکتا ھے مبارک غلام,2022-04-10 20:10:20
344,344,0,گدھا بہر آج یقین ,2022-04-10 20:10:20
345,345,0,فاروق بندیال اداکارہ شبنم ریپ بھائی عطا بندیال پاکستان غیرت ناموس پامال ب,2022-04-10 20:10:20
346,346,3,انصاف تیار امپورٹڈحکومتنامنظور,2022-04-10 20:10:20
347,347,5,عمران خان بغیر اتنی تعداد عوام نکل عمران خان صاحب خود نکل منظر امپورٹڈحکومت,2022-04-10 20:10:20
348,348,0,روز حکومت گر جشن منا دن احتجاج کمال پانڈے جی,2022-04-10 20:10:20
349,349,0,اصل عوامی طاقت ساتھ دیکھ آرمی چیف جنرل قمر جاوید باجوہ صاحب فائیو ممیز ججز ہائی کورٹ اط,2022-04-10 20:10:20
350,350,3,ب ھکاری باپ پاکستانی ,2022-04-10 20:10:20
351,351,3,اتنا احتجاج میڈیا دکھ ,2022-04-10 20:10:20
352,352,0,جناب آج ٹویٹ شہر حق نکلا جواب ,2022-04-10 20:10:20
353,353,0,شمع فروزاں آندھی ڈراتا شمع فروزاں پروانہ ہزار امپورٹڈگورمنٹنامنظور,2022-04-10 20:10:20
354,354,0,پاکستان جمہوریت حسن سیٹ اپوزیشن سیٹ اقتدار پاکستان جمہوریت بد صورتی,2022-04-10 20:10:20
355,355,1,لوگ باہر لوگ نکل جلسا ملک باہر بغیر لیڈر خود خان باہرایگا حال نام شر,2022-04-10 20:10:20
356,356,3,اتنا احتجاج میڈیا دکھ ویسےکوئی فرق پڑ میڈیادیکھتا ,2022-04-10 20:10:21
357,357,0,بلیئن ٹری سونامی سکینڈل ارب درخت ایماندار نیازی کرپٹ حکومت پچھلا سات سال عوام غلط بیانی ارب روپہ گھپلہ سرا ارب درخت درخت اکثریت غائب علاوہ کئی ٹھیکیدار کیش ادا پتہ ,2022-04-10 20:10:21
358,358,5,برا حال بھکاری انشاء اللہ امپورٹڈحکومتنامنظور,2022-04-10 20:10:21
359,359,0,شہباز شریف کاغذہ نامزدگی چیلنج چاہئے ضمانت ملزم شخص وقت مجرم بن ,2022-04-10 20:10:21
