,Unnamed: 0,cluster,tweets,timestamp
360,360,0,آج پورا پاکستان گھر تالا گھر سارا فرد سڑک تین گھنٹہ گھر واپس نہی,2022-04-10 20:10:21
361,361,3,اتنا احتجاج میڈیا دکھ ,2022-04-10 20:10:21
362,362,0,جناب آج ٹویٹ شہر حق نکلا جواب ,2022-04-10 20:10:21
363,363,3,اتنا احتجاج میڈیا دکھ ,2022-04-10 20:10:21
364,364,0,انقلاب دستک معتبر لوگ ادارہ میڈیا آنکھ پھیرا کوشش یاد سورج روشنی آنکھ فرق پڑ ہوش ناخن انقلاب کنٹرول حقیقت سامنا عمران خان زندہ باد,2022-04-10 20:10:21
365,365,0,اتنا پیمانے مظاہرے کہیں فوج مخالف نعر اطلاع مل فرق محب وطن لیڈر بکاؤ گیدڑ,2022-04-10 20:10:21
366,366,5,غلط جگہ چھیڑ بیٹھ بھائی لوگ کل رات عمران خان ہاتھ پیر باندھ مفلوج پورا ,2022-04-10 20:10:21
367,367,1,لوگ باہر لوگ نکل جلسا ملک باہر بغیر لیڈر خود خان باہرایگا حال نام شر,2022-04-10 20:10:21
368,368,0,چور ,2022-04-10 20:10:21
369,369,5,کراچی مصروف کم باہر نکلتا بات قومی غیرت خودداری سچا لیڈر ساتھ اظہار,2022-04-10 20:10:21
370,370,0,ویسی بھرنی ٹائم نیوز چینل کوریج سوائے مالشی چینل ک,2022-04-10 20:10:21
371,371,5,عوام اب غیرت دکھانی غدار بائیکاٹ انکا گھر نکلنا محال کردیں گور ملک غدار لوگ,2022-04-10 20:10:22
372,372,0,جناب آج ٹویٹ شہر حق نکلا جواب ,2022-04-10 20:10:22
373,373,3,لاہور لبرٹی مارکیٹ پسندیدہ ہوٹل سینڈوچ منگوانا راستہ بند سوشل میڈیا دیکھ دنگ,2022-04-10 20:10:22
374,374,0,حکومت دوران ضمنی الیکشن سیٹ ہارنا خلاف عالمی شازش ,2022-04-10 20:10:22
375,375,0,ہمت ہارو غم کھاؤ ایمان غالب القرآن,2022-04-10 20:10:22
376,376,0,مہینہ تحریک عدم اعتماد حمایت کامیاب عمران خان تحریک انصاف,2022-04-10 20:10:22
377,377,5,عرض سیاست فیصلہ عدالت کوشش تباہ کن سمجھ آج باہر نکلیں عو,2022-04-10 20:10:22
378,378,0,لمحہ انعام امتحان جماعت مل تکبر شکست اب متحد عوام مسئلہ حل آپس,2022-04-10 20:10:22
379,379,0,سر أپ سکسٹی زندگی شہر عوام نکلتا دیکھ ,2022-04-10 20:10:22
380,380,3,لاہور لبرٹی مارکیٹ پسندیدہ ہوٹل سینڈوچ منگوانا راستہ بند سوشل میڈیا دیکھ دنگ,2022-04-10 20:10:22
381,381,0,پاکستان سٹیک ہولڈرز منہ زوردار تھپڑ محسوس حس ,2022-04-10 20:10:22
382,382,0,رات بارہ بج چیپ جسٹس عدالت عوام دھمکی عوام تاحیات اہل دیگا دھمکی جواب عوام آج,2022-04-10 20:10:22
383,383,2,راولپنڈی لوگ سڑک پہ چھتہ پاکستان شہر سمیت دنیا بھر عمران خاں حق مظاہرے حالات م,2022-04-10 20:10:22
384,384,3,آپکی رائے تحریک انصاف اسمبلی مستعفی چاہیے ,2022-04-10 20:10:22
385,385,0,چینل اینکرز رولنگ مسترد عدم منظور اتنا زور ڈائپر بھر اندازہ ا,2022-04-10 20:10:22
386,386,0,دیکھ عوام سمندر تمکو چلتی مشین ہاتھ عمران خان نکال اللہ اسکا محافظ ر,2022-04-10 20:10:22
387,387,1,لوگ باہر لوگ نکل جلسا ملک باہر بغیر لیڈر خود خان باہرایگا حال نام شر,2022-04-10 20:10:22
388,388,0,انسان اقوام متحدہ خدائی دعوی دنیاوی قوتہ اللہ نبی کریم صل اللہ علیہ والہ,2022-04-10 20:10:23
389,389,0,جناب صاحب جنگ مصلت لڑنا واجب پہ جنگ مصلت ایمان ک,2022-04-10 20:10:23
390,390,1,لوگ باہر لوگ نکل جلسا ملک باہر بغیر لیڈر خود خان باہرایگا حال نام شر,2022-04-10 20:10:23
391,391,5,رک جائیے خان صاحب اسمبلی استعفا خود کشی مشورہ معلومات غلط شائد ایجنٹ ,2022-04-10 20:10:23
392,392,5,دبا پاؤں جاگ عمران خان شیر لوگ اکیلا گرجتا اسکا لیڈر کمال,2022-04-10 20:10:23
393,393,5,عرض سیاست فیصلہ عدالت کوشش تباہ کن سمجھ آج باہر نکلیں عو,2022-04-10 20:10:23
394,394,0,پاکستان شہر احتجاج غیرت مند عوام آواز امپورٹڈحکومتنامنظور بھکاری حکومت نامنظور بچہ,2022-04-10 20:10:23
395,395,0,پاکستانی گزارش فیسبک ٹویٹر واٹس ایپ سٹیٹس واٹس ایپ گروپس جگہ عوام سمندر ویڈیوز لگائیں پھیلا,2022-04-10 20:10:23
396,396,0,اسما شوکت مطابق پیٹرول ڈلوایا پیٹرول پمپ پیس وائسرا شہبازشریف ,2022-04-10 20:10:23
397,397,3,اتنا احتجاج میڈیا دکھ ,2022-04-10 20:10:23
398,398,0,آزادی مل تحریک آج دن عمران خان قیادت شروع اللہ کامیابی آمین امپورٹڈ,2022-04-10 20:10:23
399,399,5,عرض سیاست فیصلہ عدالت کوشش تباہ کن سمجھ آج باہر نکلیں عو,2022-04-10 20:10:23
400,400,0,نیا چیف تقرر مدت نومبر پوری جنوری الیکشن م شکل ,2022-04-10 20:10:23
401,401,5,پاکستان تاریخ شہر ہوارمضان المبارک مہینہ اتنی رات شر لوگ گھر نکل سوچ پاکستانی عوام چار دن بھول امپورٹڈحکومتنامنظور,2022-04-10 20:10:23
402,402,0,سوچ ناں ڈرو دن کپتان کال سونامی اسلام آباد داخل امپورٹڈحکومتنامنظور,2022-04-10 20:10:23
403,403,0,حرام خور نمک حرامی ملک آئین ساتھ غداری نیازی ,2022-04-10 20:10:23
404,404,0,واہ سلواٹ اپ بہادر خاتون ,2022-04-10 20:10:23
405,405,0,حسینی حسین ڈٹ مقابلہ روک روک امپورٹڈحکومتنامنظور,2022-04-10 20:10:23
406,406,0,یزید جیت مطلب حسین ہار برحق کےلیے اکثریت درکار بہادر اکیلا جیت شجاعت ,2022-04-10 20:10:24
407,407,0,علماء ناموس رسالت دشمن یورپ امریکہ خلاف کھڑے حالت ابن علقمی بغداد علماء جی,2022-04-10 20:10:24
408,408,5,حساب لوگ خان سپورٹ باہر عاشقان جی ایچ کیو تحریک لبیک جلدی آڈر مل ,2022-04-10 20:10:24
409,409,0,جی علیم پیسہ ترین پیسہ لاکھ مجمع اب اکٹھا ملک طول عرض امپورٹڈحکومتنامنظور,2022-04-10 20:10:24
410,410,0,ایکـ دل جانـے کہاں کھو زنـدگی اکـــــ وقفـــ جاناں ,2022-04-10 20:10:24
411,411,0,مرمت ,2022-04-10 20:10:24
412,412,0,پرامن احتجاج جماعت بنیادی حق پی ٹی مظاہرہ کووریج روک غلط کام پی ٹی کام ص,2022-04-10 20:10:24
413,413,0,شمع فروزاں آندھی ڈراتا شمع فروزاں پروانہ ہزار امپورٹڈگورمنٹنامنظور,2022-04-10 20:10:24
414,414,1,لوگ باہر لوگ نکل جلسا ملک باہر بغیر لیڈر خود خان باہرایگا حال نام شر,2022-04-10 20:10:24
415,415,0,جی علیم پیسہ ترین پیسہ لاکھ مجمع اب اکٹھا ملک طول عرض امپورٹڈحکومتنامنظور,2022-04-10 20:10:24
416,416,3,لاہور لبرٹی مارکیٹ پسندیدہ ہوٹل سینڈوچ منگوانا راستہ بند سوشل میڈیا دیکھ دنگ,2022-04-10 20:10:25
417,417,3,اتنا احتجاج میڈیا دکھ ویسےکوئی فرق پڑ میڈیادیکھتا ,2022-04-10 20:10:25
418,418,2,راولپنڈی لوگ سڑک پہ چھتہ پاکستان شہر سمیت دنیا بھر عمران خاں حق مظاہرے حالات م,2022-04-10 20:10:25
419,419,0,باوجوہ چار مشٹنڈہ استعفی محکمہ دفع غیرت مند محب وطن پاکستانی بچہ پاکستان آرمی چیف عہدہ قوم امانت باجوے بیچ ,2022-04-10 20:10:25
420,420,0,پاکستانی دل خوش اپ اج پوری دنیا پاکستان شہر احتجاج ریلی دیکھ یقین خان تہا ٸ,2022-04-10 20:10:25
421,421,1,لوگ باہر لوگ نکل جلسا ملک باہر بغیر لیڈر خود خان باہرایگا حال نام شر,2022-04-10 20:10:25
422,422,0,ہجوم قوم سفر مبارک پاکستان زندہ آباد امپورٹڈحکومتنامنظور,2022-04-10 20:10:25
423,423,0,روشن ڈیجیٹل اکاؤنٹس پیس ٹرانسفر پلیز نواز شریف دور اکاؤنٹس فریز ,2022-04-10 20:10:25
424,424,3,اتنا احتجاج میڈیا دکھ ویسےکوئی فرق پڑ میڈیادیکھتا ,2022-04-10 20:10:25
425,425,0,سنا غلامو حال سوری سلام اندرونی مسلمان دیکھاوے ویسے غلا,2022-04-10 20:10:25
426,426,0,سنو رونگٹہ کھڑے پاکستان کراچی عوام عمران ,2022-04-10 20:10:25
427,427,0,مبارک پی ٹی والو عمران خان گھر ,2022-04-10 20:10:25
428,428,0,وزیر اعظم ہاؤس چھوڑا پہلےمیرے کپتان میڈیا اینکرز سوال بتاؤ عوام علاوہ کوئ میر,2022-04-10 20:10:25
429,429,0,بہ وڈی غلطی بیٹھ سرکار بہ وڈی سزا یافتہ بھکاری وزیر اعظم بنا ضد ڈوبا ڈوب,2022-04-10 20:10:25
430,430,0,پیاری بہن عمران نیازی سوشل میڈیا ایکٹوسٹ زریعہ ملک خانہ جنگی دھکیل بھاری رقم ادا مشہور باقی سمجھدار وسلام,2022-04-10 20:10:25
431,431,0,باغی ملک حاوی چک لبیک حسین علیہ السلام امپورٹڈگورنمنٹنامنظور حسابباقیہے,2022-04-10 20:10:25
432,432,0,رات پائے آنکھ آنس روک پا دل افسردہ سر سایہ ہٹ,2022-04-10 20:10:26
433,433,0,پیدا ہ وا پاکستان آزاد پاکستان,2022-04-10 20:10:26
434,434,5,عرض سیاست فیصلہ عدالت کوشش تباہ کن سمجھ آج باہر نکلیں عو,2022-04-10 20:10:26
435,435,0,عدلیہ فوج اپوزیشن سوچ عمران ریکوڈک جرمانہ معاف کرا اکاونٹ کھلوا کڑوڑ ڈالر ,2022-04-10 20:10:26
436,436,0,غدار سلیکٹیڈ ٹولا مقابلہ غیور آزاد خودمختار خودار جنونی پاکستانی آج پوری قوم عمران خان حق اع,2022-04-10 20:10:26
437,437,5,عرض سیاست فیصلہ عدالت کوشش تباہ کن سمجھ آج باہر نکلیں عو,2022-04-10 20:10:26
438,438,0,خاندان حادثہ موقع ساتھ حادثہ متحد گیے عم,2022-04-10 20:10:26
439,439,3,تحریک انصاف امیر غریب ,2022-04-10 20:10:26
440,440,0,عمران خان پاکستان پہلا وزیر اعظم خلاف عدم اعتماد کامیاب ئی اسکی انفرادیت باقی کرپشن,2022-04-10 20:10:26
441,441,0,تین فوجی ٹرک پولیس وین دیکھ بھاگا ادا یوتھی دنیا ویران واہ کھان سانپ تیریا دلیری حساب,2022-04-10 20:10:26
442,442,1,لوگ باہر لوگ نکل جلسا ملک باہر بغیر لیڈر خود خان باہرایگا حال نام شر,2022-04-10 20:10:26
443,443,5,حساب لوگ خان سپورٹ باہر عاشقان جی ایچ کیو تحریک لبیک جلدی آڈر مل ,2022-04-10 20:10:26
444,444,0,چینل اینکرز رولنگ مسترد عدم منظور اتنا زور ڈائپر بھر اندازہ ا,2022-04-10 20:10:26
445,445,3,تحریک انصاف امیر غریب ,2022-04-10 20:10:26
446,446,2,راولپنڈی لوگ سڑک پہ چھتہ پاکستان شہر سمیت دنیا بھر عمران خاں حق مظاہرے حالات م,2022-04-10 20:10:26
447,447,0,پرامن احتجاج جماعت بنیادی حق پی ٹی مظاہرہ کووریج روک غلط کام پی ٹی کام ص,2022-04-10 20:10:26
448,448,1,لوگ باہر لوگ نکل جلسا ملک باہر بغیر لیڈر خود خان باہرایگا حال نام شر,2022-04-10 20:10:26
449,449,0,دیکھ آنکھ کھول دیکھ بےشرم جاہل سمجھ عوام اب بتائیے وزیراعظم ایماندار,2022-04-10 20:10:26
450,450,0,آج ملک عوام فوج سےدور بیرونی دشمن کامیاب عوام محبت فوج کیلیے دن بڑ,2022-04-10 20:10:26
451,451,3,لاہور لبرٹی مارکیٹ پسندیدہ ہوٹل سینڈوچ منگوانا راستہ بند سوشل میڈیا دیکھ دنگ,2022-04-10 20:10:26
452,452,0,گونگا بہرا عدالت جی ایچ کیو دیکھ آنکھ کھول حشر اصل حشر ,2022-04-10 20:10:26
453,453,0,یزید جیت مطلب حسین ہار برحق کےلیے اکثریت درکار بہادر اکیلا جیت شجاعت ,2022-04-10 20:10:26
454,454,2,راولپنڈی لوگ سڑک پہ چھتہ پاکستان شہر سمیت دنیا بھر عمران خاں حق مظاہرے حالات م,2022-04-10 20:10:27
455,455,0,قوم جاگ جاۓ طاقت قوم کھڑی رب کائنات لیڈر فخر پاکستان عمران خان آفت,2022-04-10 20:10:27
456,456,3,اتنا احتجاج میڈیا دکھ ,2022-04-10 20:10:27
457,457,0,سیاستدان بیوروکریٹ نیندیں حرام اب آرام کدھر پہ ,2022-04-10 20:10:27
458,458,0,پاکستانیو ایمان اتحاد تنظیم مبارک غداری بیماری بھکاری,2022-04-10 20:10:27
459,459,0,چینل اینکرز رولنگ مسترد عدم منظور اتنا زور ڈائپر بھر اندازہ ا,2022-04-10 20:10:27
460,460,0,سوشل میڈیا حکومت بن ٹوٹ دنیا پہ ہیکرز راج جان ٹرینڈ بن بنا ,2022-04-10 20:10:27
461,461,0,کراچی راشد منہاس روڈ سرگودھا کچہری پل لاہور لبرٹی چوک سیالکوٹ قلب راولپنڈی مری روڈ اسلام,2022-04-10 20:10:27
462,462,5,عوام موٹو اب پچھلا کمرہ چھپ بیٹھ نکلو باہر احتجاج انقلاب ,2022-04-10 20:10:27
463,463,0,آج دکان دکاندار گاہک آپس بات فحاشی اڈا کھلا رات سپریم کورٹ کھل,2022-04-10 20:10:27
464,464,0,مریم چاچو شوباز گلی محلہ نعرہ بھکاری باپ,2022-04-10 20:10:27
465,465,0,اب ,2022-04-10 20:10:27
466,466,0,حیرت ملک عام آدمی درخواست سپریم کورٹ جج ہائی کورٹ چیف جستس آدھی رات عدالت پہنچ جائی,2022-04-10 20:10:27
467,467,0,چینل اینکرز رولنگ مسترد عدم منظور اتنا زور ڈائپر بھر اندازہ ا,2022-04-10 20:10:27
468,468,3,اتنا احتجاج میڈیا دکھ ویسےکوئی فرق پڑ میڈیادیکھتا ,2022-04-10 20:10:27
469,469,4,ملک بھر ساختہ لوگ سڑک پہ نکل حیرت ٹی وی چینل کم دکھ لاہورکی کیفیت ش,2022-04-10 20:10:28
470,470,3,ب ھکاری باپ پاکستانی ,2022-04-10 20:10:28
471,471,0,آج رات عدالت کھلا عوامی احتجاج دیکھ ججز آنکھ ضرور کھلا گئ ,2022-04-10 20:10:28
472,472,5,خان اکیلا الل ہ دیکھ خود زلیل الحمدالل ہ خان کیساتھ پوری دنیا کھڑی ,2022-04-10 20:10:28
473,473,0,دیکھ عوام سمندر تمکو چلتی مشین ہاتھ عمران خان نکال اللہ اسکا محافظ ر,2022-04-10 20:10:28
474,474,2,راولپنڈی لوگ سڑک پہ چھتہ پاکستان شہر سمیت دنیا بھر عمران خاں حق مظاہرے حالات م,2022-04-10 20:10:28
475,475,0,یاد یاد یاد ,2022-04-10 20:10:28
476,476,0,سنو رونگٹہ کھڑے پاکستان کراچی عوام عمران ,2022-04-10 20:10:28
477,477,0,امپورٹڈ حکومت منظور منظور ایکسٹینشن منظور منظور بھکاری اولاد دھکا ,2022-04-10 20:10:28
478,478,0,مرمت ,2022-04-10 20:10:28
479,479,0,مرمت ,2022-04-10 20:10:28
480,480,0,بواسیر یوتھی منہ ,2022-04-10 20:10:28
481,481,0,کپتان سلیکٹ رجیکٹ ھو آخری گیند ذرداری صاحب چھکا گیند گم کردی,2022-04-10 20:10:28
482,482,0,محلاتی سازش غلطی غلطی,2022-04-10 20:10:28
483,483,0,شکریہ بوریوالہ وہاڑی سچا کپتان کھلاڑی سیاست اناڑی اکیلا امریکی,2022-04-10 20:10:28
484,484,3,لاہور لبرٹی مارکیٹ پسندیدہ ہوٹل سینڈوچ منگوانا راستہ بند سوشل میڈیا دیکھ دنگ,2022-04-10 20:10:29
485,485,1,لوگ باہر لوگ نکل جلسا ملک باہر بغیر لیڈر خود خان باہرایگا حال نام شر,2022-04-10 20:10:29
486,486,0,اللہ قسم ساری زندگی پتا حسین علیہ السلام عمران خان ساتھ ساری کربلہ سمجھ شخص عمران کردار حسین یزید مخالف امپورٹڈگورنمنٹنامنظور امپورٹڈحکومتنامنظور,2022-04-10 20:10:29
487,487,3,لاہور لبرٹی مارکیٹ پسندیدہ ہوٹل سینڈوچ منگوانا راستہ بند سوشل میڈیا دیکھ دنگ,2022-04-10 20:10:29
488,488,0,خان صاحب مقبولیت گزر روز ملٹی پلائی ماہر ریاضی دان آج حساب بتا امپورٹڈحکومتنامنظور,2022-04-10 20:10:29
489,489,2,راولپنڈی لوگ سڑک پہ چھتہ پاکستان شہر سمیت دنیا بھر عمران خاں حق مظاہرے حالات م,2022-04-10 20:10:29
490,490,0,اللہ پ ر چیونٹیوں رینگتہ عمران خان امریکی سامراج مردہ باد,2022-04-10 20:10:29
491,491,1,لوگ باہر لوگ نکل جلسا ملک باہر بغیر لیڈر خود خان باہرایگا حال نام شر,2022-04-10 20:10:29
492,492,0,پاکستانی دل خوش اپ اج پوری دنیا پاکستان شہر احتجاج ریلی دیکھ یقین خان تہا ٸ,2022-04-10 20:10:29
493,493,3,لاہور لبرٹی مارکیٹ پسندیدہ ہوٹل سینڈوچ منگوانا راستہ بند سوشل میڈیا دیکھ دنگ,2022-04-10 20:10:29
494,494,0,حق سچ راستہ خان صاحب لیڈ لمبا راستہ کامیابی اللہ مدد ضرورت پاکستان نسل خان صاحب ساتھ ,2022-04-10 20:10:29
495,495,5,ایجنسیز مطابق ملین زائد لوگ ملک بھر احتجاج احتجاج جاری تعداد ڈبل ,2022-04-10 20:10:29
496,496,1,لوگ باہر لوگ نکل جلسا ملک باہر بغیر لیڈر خود خان باہرایگا حال نام شر,2022-04-10 20:10:29
497,497,0,آج سپیس وقت دلچسپ صورتحال پیدا گئ شہباز گل کلاس فیلو فیصل باد شریک اچھا معلومات,2022-04-10 20:10:29
498,498,0,شمع فروزاں آندھی ڈراتا شمع فروزاں پروانہ ہزار امپورٹڈگورمنٹنامنظور,2022-04-10 20:10:29
499,499,3,اتنا احتجاج میڈیا دکھ ,2022-04-10 20:10:29
500,500,0,وزیر اعظم ہاؤس چھوڑا پہلےمیرے کپتان میڈیا اینکرز سوال بتاؤ عوام علاوہ کوئ میر,2022-04-10 20:10:29
501,501,5,کراچی مصروف کم باہر نکلتا بات قومی غیرت خودداری سچا لیڈر ساتھ اظہار,2022-04-10 20:10:29
502,502,0,تحریک انصاف یوتھ ونگ بلوچستان ژوب ریجن صدر نور کاکڑ امپورٹڈ حکومت خلاف مسلم باغ احتجاج مظاہرے خطاب سینکڑہ ع,2022-04-10 20:10:29
503,503,0,چینل اینکرز رولنگ مسترد عدم منظور اتنا زور ڈائپر بھر اندازہ ا,2022-04-10 20:10:29
504,504,0,مشرق نکلتا سورج دیکھ اب تارا دیکھ دن ,2022-04-10 20:10:29
505,505,0,لٹیرا ڈاکوؤں ضمیر فروش خلاف قوم متحد خان صاحب ضمیر سوداگر عوام الیکشن کراؤ پاکستانی بکاؤ مال بات غیرت کراچی غیور عوام تاریخ رقم امپورٹڈ حکومت مانتے,2022-04-10 20:10:29
506,506,0,نظر بات اب عمران خان ذات بالاتر نوجوان مکمل آزادی خواہاں نوجوان غلامی قبول تیار ,2022-04-10 20:10:30
507,507,3,تحریک انصاف امیر غریب ,2022-04-10 20:10:30
508,508,1,لوگ باہر لوگ نکل جلسا ملک باہر بغیر لیڈر خود خان باہرایگا حال نام شر,2022-04-10 20:10:30
509,509,0,مان نوجوان نسل بیدار چک تبدیلی شخص قوم شعور بس اب انت,2022-04-10 20:10:30
510,510,0,آپکا چیف ایگزیٹیو دھمکی مل نیوٹرل قوم نیوٹرل نہی حق ساتھ کھڑی ,2022-04-10 20:10:30
511,511,0,ہائے قربان جاوں آذادی میڈیا بات آج تحریک انصاف ملک گیر مظاہرہ کالعدم تنظیم ,2022-04-10 20:10:30
512,512,4,ملک بھر ساختہ لوگ سڑک پہ نکل حیرت ٹی وی چینل کم دکھ لاہورکی کیفیت ش,2022-04-10 20:10:30
513,513,0,قدر خوبصورت نظارہ چیری بلاسم جوتا چمکاتا پیر بیٹھکر بھیک مانگتا اسکو باجوہ سلوٹ ک,2022-04-10 20:10:30
514,514,0,اورسیزیوتھے ففتھئےخنیرہ روتا بلکتا دیکھ خوشی مل مثال اللہ جگاڑ ہ,2022-04-10 20:10:30
515,515,1,لوگ باہر لوگ نکل جلسا ملک باہر بغیر لیڈر خود خان باہرایگا حال نام شر,2022-04-10 20:10:30
516,516,0,میڈیا بلیک آوٹ کروا اکھاڑ الٹا مزید نقاب آج جنریشن معلومات کیلئے آپکا جیونیوز محتاج ,2022-04-10 20:10:30
517,517,3,اتنا احتجاج میڈیا دکھ ویسےکوئی فرق پڑ میڈیادیکھتا ,2022-04-10 20:10:30
518,518,0,کپتان میدان عمران خان اندرونی بیرونی دشمنا لرزہ طاری شاء اللہ امپورٹڈگورمنٹنامنظور,2022-04-10 20:10:30
519,519,1,لوگ باہر لوگ نکل جلسا ملک باہر بغیر لیڈر خود خان باہرایگا حال نام شر,2022-04-10 20:10:30
520,520,0,غلامی جیت مبارک ہار فخر میںہوںعمران,2022-04-10 20:10:30
521,521,3,تحریک انصاف امیر غریب ,2022-04-10 20:10:30
522,522,0,مرشد عمران خان صاحب آپے جان قربان جینا سکھ آپکو چھوڑ ہجوم قوم بنا اب ,2022-04-10 20:10:30
523,523,5,کراچی مصروف کم باہر نکلتا بات قومی غیرت خودداری سچا لیڈر ساتھ اظہار,2022-04-10 20:10:31
524,524,0,شمع فروزاں آندھی ڈراتا شمع فروزاں پروانہ ہزار امپورٹڈحکومتنامنظور,2022-04-10 20:10:31
525,525,0,آج احتجاج تیار عمران خان پاکستانیو امپورٹڈحکومتنامنظور,2022-04-10 20:10:31
526,526,3,ب ھکاری باپ پاکستانی ,2022-04-10 20:10:31
527,527,0,مرمت ,2022-04-10 20:10:31
528,528,0,اکیلا نہی چھوڑسکھت عمران خان اب ضد ,2022-04-10 20:10:31
529,529,0,بھائی علاقہ تحریک ون کروا شاءالل ه بھائی فاروق کمانڈو بھائی بلا اتنا پ,2022-04-10 20:10:31
530,530,0,بات شروع ,2022-04-10 20:10:31
531,531,0,رمضان المبارک اللہ فرمان روزا محش گوئی شور مچائے,2022-04-10 20:10:31
532,532,0,کہاں سارا لگاؤ نعرہ پتا لبیک لبیک یارسول اللہ ﷺ حسابباقیہے,2022-04-10 20:10:31
533,533,3,تحریک انصاف امیر غریب ,2022-04-10 20:10:31
534,534,3,اتنا احتجاج میڈیا دکھ ,2022-04-10 20:10:31
535,535,4,ملک بھر ساختہ لوگ سڑک پہ نکل حیرت ٹی وی چینل کم دکھ لاہورکی کیفیت ش,2022-04-10 20:10:32
536,536,0,کل پوچھ مخالف لفظ دل چیرپھاڑ اج دیکھ کپتان پورا پاکستان عوام سڑک کوئ شہر بیٹا سچائ بہادری گواہی وقت سڑک پہ امپورٹڈ حکومت نامنظور منظور,2022-04-10 20:10:32
537,537,0,ڈاکٹر ارسلان خالد گھر حملہ خبر انتہائ تشویش ارسلان انتہائ باصلاحیت زیرک مخلص نوجوان پوری ت,2022-04-10 20:10:32
538,538,0,اپنامعززیف جسٹس پوچھناتھاکہ سانحہ بلدیہ ٹاؤن سانحہ ماڈل ٹاؤن کوئٹہ دن دیہاڑے مجیداچکزئی گاڑی تلاآکر ک چلےجانے,2022-04-10 20:10:32
539,539,0,روز حکومت گر جشن منا دن احتجاج کمال پانڈے جی,2022-04-10 20:10:32
540,540,0,ناموس رسالت ﷺ مارچ کتا بھونکنے آج لیڈر خاطر سڑک ذلیل پوچھنا ھے اب روڑ بلاک حلال حسابباقیہے,2022-04-10 20:10:32
541,541,0,شہباز شریف کاغذہ نامزدگی بطور وزیراعظم مسترد نیب ایف مقدمہ ,2022-04-10 20:10:32
542,542,0,عمران خان بائیکاٹ انشا الل ہ صفر ,2022-04-10 20:10:32
543,543,3,تحریک انصاف امیر غریب ,2022-04-10 20:10:32
544,544,0,گھر در گھر در پاک مژدہ گھرو صلا اچ ھے گھر حسابباقیہے,2022-04-10 20:10:32
