,Unnamed: 0,cluster,tweets,timestamp
725,725,0,اہلسنت گلستہ کلی گلاب چمپا چمبیلی حسابباقیہے,2022-04-10 20:10:43
726,726,0,سیاست فیصلہ عدالت کوشش تباہ کن فواد چودھری,2022-04-10 20:10:43
727,727,0,امپورٹڈحکومتنامنظور چور اچکا حکومت سمیت نست نابود جاو لوگ سوچ مرشد ذلیل کل ,2022-04-10 20:10:43
728,728,0,وقت باجوہ اسٹیبلشمنٹ شاہ محمود وزیر اعظم بن جتنا مٹی پلید چک اضافہ الیکشن کروا فوج شدت ساتھ عوام لاو وقت عوام ننگا چک امپورٹڈگورمنٹنامنظور,2022-04-10 20:10:43
729,729,1,لوگ باہر لوگ نکل جلسا ملک باہر بغیر لیڈر خود خان باہرایگا حال نام شر,2022-04-10 20:10:43
730,730,0,چور ہاتھ ڈالا اکٹھا معلوم سابق وزیراعظم عمران خان جملہ ,2022-04-10 20:10:43
731,731,0,تھپڑا نشان پڑ,2022-04-10 20:10:44
732,732,5,عوام اب غیرت دکھانی غدار بائیکاٹ انکا گھر نکلنا محال کردیں گور ملک غدار لوگ,2022-04-10 20:10:44
733,733,0,جناب صاحب جنگ مصلت لڑنا واجب پہ جنگ مصلت ایمان ک,2022-04-10 20:10:44
734,734,4,ملک بھر ساختہ لوگ سڑک پہ نکل حیرت ٹی وی چینل کم دکھ لاہورکی کیفیت ش,2022-04-10 20:10:44
735,735,0,کرواڈ فیک وڈیو ز ورلڈ کپ خان جیت لبرٹی چوک لاہور لاکھ مجمعہ وڈیوز ,2022-04-10 20:10:44
736,736,5,عمران خان بغیر اتنی تعداد عوام نکل عمران خان صاحب خود نکل منظر امپورٹڈحکومت,2022-04-10 20:10:44
737,737,0,بچہ نسل مجما اکٹھا نئ ,2022-04-10 20:10:44
738,738,0,پی پی نون لیگ ساتھ ہاتھ شہباز وزیراعظم بن چکر ذلیل انشاء,2022-04-10 20:10:44
739,739,0,چیرمین پاکستان تحریک انصاف عمران خان زیر صدارت کل بروز سوموار تحریک انصاف پارلیمانی پارٹی اجلاس انشاء,2022-04-10 20:10:44
740,740,0,اکیلا ہجوم کھڑا شکریہ امپورٹڈحکومتنامنظور پاکستانکتنے کابیچا,2022-04-10 20:10:44
741,741,3,اتنا احتجاج میڈیا دکھ ,2022-04-10 20:10:44
742,742,0,پس_وپیش ثابت گاہک پیسےوالا ایمان اتوار دن ب ک جنرل مشرف لکل ٹھیک عمران خان شرمندہ وجہ ,2022-04-10 20:10:44
743,743,4,ملک بھر ساختہ لوگ سڑک پہ نکل حیرت ٹی وی چینل کم دکھ لاہورکی کیفیت ش,2022-04-10 20:10:44
744,744,1,لوگ باہر لوگ نکل جلسا ملک باہر بغیر لیڈر خود خان باہرایگا حال نام شر,2022-04-10 20:10:44
745,745,0,اپنامعززیف جسٹس پوچھناتھاکہ سانحہ بلدیہ ٹاؤن سانحہ ماڈل ٹاؤن کوئٹہ دن دیہاڑے مجیداچکزئی گاڑی تلاآکر ک چلےجانے,2022-04-10 20:10:44
746,746,2,راولپنڈی لوگ سڑک پہ چھتہ پاکستان شہر سمیت دنیا بھر عمران خاں حق مظاہرے حالات م,2022-04-10 20:10:44
747,747,5,جیؤ نیوز مان پورا پاکستان عوام سمندر باہر نکل ثبوت جیؤ نیوز ,2022-04-10 20:10:44
748,748,0,سحری اتجاج کوشش کل کال مصول انتظام سنبھالے بھرپور احتجاج شامل ملک اب اپ ضرورت ,2022-04-10 20:10:44
749,749,3,اتنا احتجاج میڈیا دکھ ,2022-04-10 20:10:45
750,750,2,راولپنڈی لوگ سڑک پہ چھتہ پاکستان شہر سمیت دنیا بھر عمران خاں حق مظاہرے حالات م,2022-04-10 20:10:45
751,751,0,غلطی دیر کل سوشل میڈیا سامراجی گھیراٶ آج حالات ہوت,2022-04-10 20:10:45
752,752,0,سوشل میڈیا حکومت بن ٹوٹ دنیا پہ ہیکرز راج جان ٹرینڈ بن بنا ,2022-04-10 20:10:44
753,753,0,شہر جہاں عوام سمندر نکلا روزہ باوجود جذبہ جنون قابل تعریف ,2022-04-10 20:10:45
754,754,0,جمہوری فیصلہ چک صدارتی نظام تحت سر عمران خان چاہیۓ امریکہ غلام جاۓ,2022-04-10 20:10:45
755,755,3,لاہور لبرٹی مارکیٹ پسندیدہ ہوٹل سینڈوچ منگوانا راستہ بند سوشل میڈیا دیکھ دنگ,2022-04-10 20:10:45
756,756,0,عمران خان حکومت خاتمہ اگلا دن شمالی وزیرستان امریکہ ڈرون حملہ فرد شہید حملہ بھرپور مذمت ,2022-04-10 20:10:45
757,757,3,اتنا احتجاج میڈیا دکھ ویسےکوئی فرق پڑ میڈیادیکھتا ,2022-04-10 20:10:46
758,758,0,پاکستان تاریخ پہلا دفعہ چیف آف آرمی سٹاف شدید ترین ذلت ساتھ رخصت ,2022-04-10 20:10:46
759,759,4,ملک بھر ساختہ لوگ سڑک پہ نکل حیرت ٹی وی چینل کم دکھ لاہورکی کیفیت ش,2022-04-10 20:10:46
760,760,0,کپتان نظریاتی ورکر خان صاحب ساتھ شانہ بشانہ کھڑے نظریہ پاکستان دفاع ک,2022-04-10 20:10:46
761,761,3,تحریک انصاف امیر غریب ,2022-04-10 20:10:46
762,762,0,چینی سکینڈل ایماندار نیازی حکومت طرہ امتیاز کافی بحث چک جان چینی سکینڈل نیازی حکومت ٹارگٹڈ سبسڈی سستا دام برآمد مہنگہ دام چینی درآمد ارب روپہ چونا لگا,2022-04-10 20:10:46
763,763,0,اللہ قسم ساری زندگی پتا حسین علیہ السلام عمران خان ساتھ ساری کربلہ سمجھ شخص عمران کردار حسین یزید مخالف امپورٹڈگورنمنٹنامنظور امپورٹڈحکومتنامنظور,2022-04-10 20:10:46
764,764,3,تحریک انصاف امیر غریب ,2022-04-10 20:10:46
765,765,0,واہ سلواٹ اپ بہادر خاتون ,2022-04-10 20:10:46
766,766,0,بریکنگ احتجاج دائراہ مزید لاکھ ٹائیگرز کارکن فیض آباد روانہ سئیکئورٹی ڈبل ,2022-04-10 20:10:46
767,767,1,لوگ باہر لوگ نکل جلسا ملک باہر بغیر لیڈر خود خان باہرایگا حال نام شر,2022-04-10 20:10:46
768,768,5,شروعات حریت پاسپاں خود نکل عالم سازش والو ہوش ناخن ,2022-04-10 20:10:46
769,769,0,لاہور فیصلہ س اگلا الیکشن لاہور سمیت پنجاب عمران خان تہائی اکثریت نکل انشاءال,2022-04-10 20:10:46
770,770,1,لوگ باہر لوگ نکل جلسا ملک باہر بغیر لیڈر خود خان باہرایگا حال نام شر,2022-04-10 20:10:46
771,771,0,عدالت کھلوا خط دیکھانے سازش کامیاب عمران خان استعفا دینگا امپورٹڈحکومتن,2022-04-10 20:10:46
772,772,3,آپکی رائے تحریک انصاف اسمبلی مستعفی چاہیے ,2022-04-10 20:10:46
773,773,0,عشاق رسول پچھلا رمضان لہو لہان امریکہ کہاں ملعونہ آسیہ قبل کینیڈا روانہ امریکہ,2022-04-10 20:10:46
774,774,0,غلط لوگ پنگا بیٹھ سکرپٹ آرپار کردیں اسکا رائٹر امپورٹڈحکومتنامنظور,2022-04-10 20:10:46
775,775,0,دفعہ دفعہ ,2022-04-10 20:10:46
776,776,0,عمران خان پاکستان پہلا وزیر اعظم خلاف عدم اعتماد کامیاب ئی اسکی انفرادیت باقی کرپشن,2022-04-10 20:10:47
777,777,0,جی فوتگی امپورٹڈحکومتنامنظور,2022-04-10 20:10:47
778,778,4,ملک بھر ساختہ لوگ سڑک پہ نکل حیرت ٹی وی چینل کم دکھ لاہورکی کیفیت ش,2022-04-10 20:10:47
779,779,0,سنو رونگٹہ کھڑے پاکستان کراچی عوام عمران ,2022-04-10 20:10:47
780,780,0,آج عوام خواب غفلت جاگنا خوش آئند خوشی عمران خان دشمنا کانٹا کھٹک ا,2022-04-10 20:10:47
781,781,0,امریکی نامزد امیدوار برائے اسلامی جمہوریہ پاکستان شہباز شریف پہ کل فرد جرم روک ٹیم کل عدالت,2022-04-10 20:10:47
782,782,0,رات دس بج چھوڑ شام پانچ بج ایمرجنسی مر خاندان زندگی دار مدار عدالت ,2022-04-10 20:10:47
783,783,5,قابل یقین عوامی احتجاج لوگ خان تنگ مہنگائی مارا مسیحائی منتظر باہر اتنی تعداد رات دانشور میروں صافی خانزاد سال جھوٹا بیانیہ دھڑام نیچے گرا عوامی طاقت,2022-04-10 20:10:47
784,784,0,اب سمجھ آخر رگیدا قوم فرد دیکھ مینڈیٹ نقب زنی آج,2022-04-10 20:10:47
785,785,3,ب ھکاری باپ پاکستانی ,2022-04-10 20:10:47
786,786,5,لوگ اندر بس لوگ فوج عدلیہ خلاف بھونک کہیں بھائی لوگ پورا اندر آنکھ باہر ,2022-04-10 20:10:47
787,787,1,لوگ باہر لوگ نکل جلسا ملک باہر بغیر لیڈر خود خان باہرایگا حال نام شر,2022-04-10 20:10:47
788,788,2,راولپنڈی لوگ سڑک پہ چھتہ پاکستان شہر سمیت دنیا بھر عمران خاں حق مظاہرے حالات م,2022-04-10 20:10:47
789,789,0,سر آپکی ٹویٹ گھنٹہ سوچ بچار فیصلہ پہنچ اب نیوٹرل ففت,2022-04-10 20:10:47
790,790,3,ب ھکاری باپ پاکستانی ,2022-04-10 20:10:47
791,791,0,اسلام آباد ڈی چوک نعرہ بازی ملک چوکیدار غدار غدار ,2022-04-10 20:10:47
792,792,0,اللہ تعالی قرآن مجید فرما یہود نصاری دوست عمران خان وقت فرانسیسی,2022-04-10 20:10:47
793,793,3,تحریک انصاف امیر غریب ,2022-04-10 20:10:48
794,794,0,وزیر اعظم ہاؤس چھوڑا پہلےمیرے کپتان میڈیا اینکرز سوال بتاؤ عوام علاوہ کوئ میر,2022-04-10 20:10:48
795,795,0,عمران خان غلط ٹھیک باقی ا س بہتر ,2022-04-10 20:10:48
796,796,0,وزیر اعظم ہاؤس چھوڑا پہلےمیرے کپتان میڈیا اینکرز سوال بتاؤ عوام علاوہ کوئ میر,2022-04-10 20:10:48
797,797,3,تحریک انصاف امیر غریب ,2022-04-10 20:10:48
798,798,2,راولپنڈی لوگ سڑک پہ چھتہ پاکستان شہر سمیت دنیا بھر عمران خاں حق مظاہرے حالات م,2022-04-10 20:10:48
799,799,0,کھانا کھا شرمو امپورٹڈحکومتنامنظور,2022-04-10 20:10:48
800,800,0,قوم جاگ جاۓ طاقت قوم کھڑی رب کائنات لیڈر فخر پاکستان عمران خان آفت,2022-04-10 20:10:48
801,801,0,بھٹی تاریخ بدل دہی آج کنفیاژن چھوڑو صحیح سائیڈ کھڑے ,2022-04-10 20:10:48
802,802,0,چکیں غالب بلائیں مرگ ناگہانی غالب,2022-04-10 20:10:48
803,803,3,ب ھکاری باپ پاکستانی ,2022-04-10 20:10:48
804,804,0,ہائے قربان جاوں آذادی میڈیا بات آج تحریک انصاف ملک گیر مظاہرہ کالعدم تنظیم ,2022-04-10 20:10:48
805,805,0,عمران خان محبت لاہور کراچی اسلام آباد ملتان جھگڑا ختم ,2022-04-10 20:10:48
806,806,0,آج افسوس بےشمار ٹرینڈ ز کتنا اکاؤنٹ گنوائے لوگ دفاع بیچ می,2022-04-10 20:10:48
807,807,4,ملک بھر ساختہ لوگ سڑک پہ نکل حیرت ٹی وی چینل کم دکھ لاہورکی کیفیت ش,2022-04-10 20:10:48
808,808,5,عمران خان بغیر اتنی تعداد عوام نکل عمران خان صاحب خود نکل منظر امپورٹڈحکومتنامنظور,2022-04-10 20:10:48
809,809,0,ملک نشی زانی صادق امین جہاں عدالت سٹا لیکر ڈپٹی اسپیکر اسمبلی ملک دہشت گرد صدر وزیراعظم چپڑاسی وزیر داخلہ ممکن ,2022-04-10 20:10:48
810,810,0,وزیر اعظم ہاؤس چھوڑا پہلےمیرے کپتان میڈیا اینکرز سوال بتاؤ عوام علاوہ کوئ میر,2022-04-10 20:10:49
811,811,5,عوام موٹو اب پچھلا کمرہ چھپ بیٹھ نکلو باہر احتجاج انقلاب ,2022-04-10 20:10:49
812,812,1,لوگ باہر لوگ نکل جلسا ملک باہر بغیر لیڈر خود خان باہرایگا حال نام شر,2022-04-10 20:10:49
813,813,1,لوگ باہر لوگ نکل جلسا ملک باہر بغیر لیڈر خود خان باہرایگا حال نام شر,2022-04-10 20:10:49
814,814,0,فیان خدا ساتھ ,2022-04-10 20:10:49
815,815,0,جناب آج ٹویٹ شہر حق نکلا جواب ,2022-04-10 20:10:49
816,816,0,یاد یاد یاد ,2022-04-10 20:10:49
817,817,0,پیارا کل صحافی پوچھ دیکھ کوٸ خلاف آج وزیراعظم عمران خا,2022-04-10 20:10:49
818,818,1,لوگ باہر لوگ نکل جلسا ملک باہر بغیر لیڈر خود خان باہرایگا حال نام شر,2022-04-10 20:10:49
819,819,0,مطلب گن پونئٹ پے ہرایا نئی کہانی سہی,2022-04-10 20:10:49
820,820,0,خان صاحب ہرگز قومی اسمبلی استعفا پی ٹی غلط فیصلہ بھان متی کنبہ حکومت منافقانہ تضاد ,2022-04-10 20:10:49
821,821,0,جناب آج ٹویٹ شہر حق نکلا جواب ,2022-04-10 20:10:49
822,822,5,عوام اب غیرت دکھانی غدار بائیکاٹ انکا گھر نکلنا محال کردیں گور ملک غدار لوگ,2022-04-10 20:10:49
823,823,0,میڈیا بلیک آوٹ کروا اکھاڑ الٹا مزید نقاب آج جنریشن معلومات کیلئے آپکا جیونیوز محتاج ,2022-04-10 20:10:49
824,824,0,حسینی حسین ڈٹ مقابلہ روک روک امپورٹڈحکومتنامنظور,2022-04-10 20:10:49
825,825,0,مرشد عمران خان صاحب آپے جان قربان جینا سکھ آپکو چھوڑ ہجوم قوم بنا اب ,2022-04-10 20:10:50
826,826,3,سمجھ بکا میڈیا روک انقلاب روک غصہ انصاف خلاف احتجاج میڈیا کوریج ,2022-04-10 20:10:50
827,827,4,ملک بھر ساختہ لوگ سڑک پہ نکل حیرت ٹی وی چینل کم دکھ لاہورکی کیفیت ش,2022-04-10 20:10:50
828,828,0,والدہ ڈھائی سال بستر مرگ اورسال والد شدید بیماری شکار ڈھائی سال میراملنا جلنا دوست,2022-04-10 20:10:50
829,829,3,اتنا احتجاج میڈیا دکھ ,2022-04-10 20:10:50
830,830,0,ڈگا کھو غصہ کمار تے شرم انسان اپوزیشن وجہ گالی نام کل رات چھپڑا مار چپ چاپ وزیراعظم ہاوس چھوڑ بن گالا دفعہ ,2022-04-10 20:10:50
831,831,5,سارا پلان الٹ عوام روز سڑک نکل ڈرو وقت عمران خان خود نکل پورا پاکستان پیک ,2022-04-10 20:10:50
832,832,0,شہباز شریف کاغذہ نامزدگی منظور ایف آئ پہلا آرڈر کل وکیل ٹیم شہباز شریف مقدمہ م,2022-04-10 20:10:50
833,833,3,ب ھکاری باپ پاکستانی ,2022-04-10 20:10:50
834,834,0,وزیر اعظم ہاؤس چھوڑا پہلےمیرے کپتان میڈیا اینکرز سوال بتاؤ عوام علاوہ کوئ میر,2022-04-10 20:10:50
835,835,0,چینل اینکر صاحب بول عوام میم نکلیں سازشی ٹولا ساتھ مل پیچھے وار بکاو مال,2022-04-10 20:10:50
836,836,0,بہ وڈی غلطی بیٹھ سرکار بہ وڈی سزا یافتہ بھکاری وزیر اعظم بنا ضد ڈوبا ڈوب,2022-04-10 20:10:50
837,837,0,بیچاری نانی گھبرا ,2022-04-10 20:10:51
838,838,0,پرامن احتجاج جماعت بنیادی حق پی ٹی مظاہرہ کووریج روک غلط کام پی ٹی کام ص,2022-04-10 20:10:51
839,839,0,دیکھ عوام سمندر تمکو چلتی مشین ہاتھ عمران خان نکال اللہ اسکا محافظ ر,2022-04-10 20:10:51
840,840,1,لوگ باہر لوگ نکل جلسا ملک باہر بغیر لیڈر خود خان باہرایگا حال نام شر,2022-04-10 20:10:51
841,841,5,عوام اب غیرت دکھانی غدار بائیکاٹ انکا گھر نکلنا محال کردیں گور ملک غدار لوگ,2022-04-10 20:10:51
842,842,0,جزبہ شکست امپورٹڈحکومتنامنظور,2022-04-10 20:10:51
843,843,0,کراچی راشد منہاس روڈ سرگودھا کچہری پل لاہور لبرٹی چوک سیالکوٹ قلب راولپنڈی مری روڈ اسلام آباد زیرو پوائینٹ عوام جم غفیر ٹی وی چینل کور ص م ب ك م عمرانہمتمارےسں امپورٹڈحکومتنامنظور,2022-04-10 20:10:51
844,844,0,بھائی رگڑا ,2022-04-10 20:10:51
845,845,0,الحمداللہﷻ کراچی آج بتا خان ساتھ کھڑے ماسٹر مائنڈ کامپ ٹانگنا شروع چک خان آخری وق,2022-04-10 20:10:51
846,846,0,سنو رونگٹہ کھڑے پاکستان کراچی عوام عمران ,2022-04-10 20:10:51
847,847,0,اوئے مرشد عمران خان بیان ہلکا مت اپوزیشن خطرناک جاوں آج احتجاج,2022-04-10 20:10:51
848,848,0,خطرناک کیفیت شخصیت سحر اتنا مبتلا آئین قانون ضابطہ حتی مہذب گفتگو بھو,2022-04-10 20:10:51
849,849,0,امپورٹڈحکومتنامنظور محترم جناب انقلاب فناہ چنگاری آگ بھڑک اٹھا اب شعلہ بلند دکھا انشااللہ,2022-04-10 20:10:51
850,850,0,پاکستانی دل خوش اپ اج پوری دنیا پاکستان شہر احتجاج ریلی دیکھ یقین خان تہا ٸ,2022-04-10 20:10:51
851,851,3,تحریک انصاف امیر غریب ,2022-04-10 20:10:51
852,852,0,ایگری ضروری بار اکثر تیسرا قدر من پسند ,2022-04-10 20:10:52
853,853,0,تحریک انصاف یوتھ ونگ بلوچستان ژوب ریجن صدر نور کاکڑ امپورٹڈ حکومت خلاف مسلم باغ احتجاج مظاہرے خطاب سینکڑہ ع,2022-04-10 20:10:52
854,854,4,ملک بھر ساختہ لوگ سڑک پہ نکل حیرت ٹی وی چینل کم دکھ لاہورکی کیفیت ش,2022-04-10 20:10:52
855,855,0,گیارہ جماعت امریکہ مل عمران خان الگ کوشش قوم سازش ناکام بنا عمران خان سات,2022-04-10 20:10:52
856,856,3,اتنا احتجاج میڈیا دکھ ویسےکوئی فرق پڑ میڈیادیکھتا ,2022-04-10 20:10:52
857,857,1,لوگ باہر لوگ نکل جلسا ملک باہر بغیر لیڈر خود خان باہرایگا حال نام شر,2022-04-10 20:10:52
858,858,0,اب یقین فالور بڑھ یوتھی باپ کڈنیپ ہوگیا حسابباقیہے,2022-04-10 20:10:52
859,859,0,اقتدار ہوس کرپشن الزام دل گھر مرشد,2022-04-10 20:10:52
860,860,3,لاہور لبرٹی مارکیٹ پسندیدہ ہوٹل سینڈوچ منگوانا راستہ بند سوشل میڈیا دیکھ دنگ,2022-04-10 20:10:52
861,861,0,چینل اینکرز رولنگ مسترد عدم منظور اتنا زور ڈائپر بھر اندازہ ا,2022-04-10 20:10:52
862,862,0,پاکستان جمہوریت حسن سیٹ اپوزیشن سیٹ اقتدار پاکستان جمہوریت بد صورتی,2022-04-10 20:10:52
863,863,3,آپکی رائے تحریک انصاف اسمبلی مستعفی چاہیے ,2022-04-10 20:10:52
864,864,0,مرشد عمران خان صاحب آپے جان قربان جینا سکھ آپکو چھوڑ ہجوم قوم بنا اب ,2022-04-10 20:10:52
865,865,0,خواب پ م لن سپنا دیکھ نیند م سکانا پاگل جھ وٹی نگری ہمیشہ دیکھ سچی بات بتا پاگل پیار چ ین بھ کب م لتا شب بھر اشک بہا پاگل ,2022-04-10 20:10:52
866,866,0,ستم ظریف لکھ یوتھیا بات سمجھانے بندہ چاہیے بات سمجھاتا دوسرا چپیڑ مارتا,2022-04-10 20:10:52
867,867,0,اب عمران خان حکومت اب میڈیا آزاد چاہیے ویسے آزادی علم بردار سنسرشپ ,2022-04-10 20:10:53
868,868,0,عمران خان ہتھیلی جان ہتھیلی تھوڑی عمران خان نکال جڑ کھوکھلی چک تمکو اندازہ,2022-04-10 20:10:53
869,869,0,عوام سمندر انشاءالل ه اب فیصلہ عوامی عدالت خان مظبوط آیگا امپورٹڈحک,2022-04-10 20:10:53
870,870,0,چیرمین پاکستان تحریک انصاف عمران خان زیر صدارت کل بروز سوموار تحریک انصاف پارلیمانی پارٹی اجلاس انشاء,2022-04-10 20:10:53
871,871,3,تحریک انصاف امیر غریب ,2022-04-10 20:10:53
872,872,0,وزیراعظم وجہ امریکہ دفعہ تکلیف پہلا تکلیف ایٹمی دھماکے دوسری بار پیک کٹا انڈا مرغی ,2022-04-10 20:10:53
873,873,0,مرشد پلیز آج وقت مرشد آج دکھڑا سنا مرشد ساتھ ظلم مرشد فوج لڑتی حریف ,2022-04-10 20:10:53
874,874,3,ب ھکاری باپ پاکستانی ,2022-04-10 20:10:53
875,875,3,ب ھکاری باپ پاکستانی ,2022-04-10 20:10:53
876,876,0,چینل اینکرز رولنگ مسترد عدم منظور اتنا زور ڈائپر بھر اندازہ ا,2022-04-10 20:10:53
877,877,0,خدا خان استعفا روک سڑک احتجاج استعفا ضروری ممبران اسمبلی اندر احتجاج پارٹی ورکرز عوام ساتھ سڑک اسمبلی چھوڑ نقصان ,2022-04-10 20:10:53
878,878,0,شمع فروزاں آندھی ڈراتا شمع فروزاں پروانہ ہزار امپورٹڈگورمنٹنامنظور,2022-04-10 20:10:53
879,879,1,لوگ باہر لوگ نکل جلسا ملک باہر بغیر لیڈر خود خان باہرایگا حال نام شر,2022-04-10 20:10:53
880,880,0,اپنامعززیف جسٹس پوچھناتھاکہ سانحہ بلدیہ ٹاؤن سانحہ ماڈل ٹاؤن کوئٹہ دن دیہاڑے مجیداچکزئی گاڑی تلاآکر ک چلےجانے,2022-04-10 20:10:53
881,881,5,عرض سیاست فیصلہ عدالت کوشش تباہ کن سمجھ آج باہر نکلیں عو,2022-04-10 20:10:53
882,882,0,لائکس ریٹویٹس اتنا زلیل چپیڑا کھا نکال چاہیے اب,2022-04-10 20:10:54
883,883,0,پاکستانی دل خوش اپ اج پوری دنیا پاکستان شہر احتجاج ریلی دیکھ یقین خان تہا ٸ,2022-04-10 20:10:54
884,884,0,لاہور فیصلہ س اگلا الیکشن لاہور سمیت پنجاب عمران خان تہائی اکثریت نکل انشاءال,2022-04-10 20:10:54
885,885,3,لاہور لبرٹی مارکیٹ پسندیدہ ہوٹل سینڈوچ منگوانا راستہ بند سوشل میڈیا دیکھ دنگ,2022-04-10 20:10:54
886,886,0,کوشش آخر کار معلوم کل نیازی باجوہ درمیان تھپڑ ماجرا کہانی لڑکی پارٹ چ,2022-04-10 20:10:54
887,887,0,پاکستانی قوم ترکی قوم جذبہ محسوس عمران خان ساتھ مزید زیادتی ن,2022-04-10 20:10:54
888,888,0,شہباز شریف کاغذہ نامزدگی بطور وزیراعظم مسترد نیب ایف مقدمہ ,2022-04-10 20:10:54
889,889,0,رات پائے آنکھ آنس روک پا دل افسردہ سر سایہ ہٹ,2022-04-10 20:10:54
890,890,1,لوگ باہر لوگ نکل جلسا ملک باہر بغیر لیڈر خود خان باہرایگا حال نام شر,2022-04-10 20:10:54
891,891,0,سنو رونگٹہ کھڑے پاکستان کراچی عوام عمران ,2022-04-10 20:10:54
892,892,0,فاروق بندیال اداکارہ شبنم ریپ بھائی عطا بندیال پاکستان غیرت ناموس پامال ب,2022-04-10 20:10:54
893,893,5,لیڈر ورلڈ بینک سمیت دنیا ملک چھوڑ جہاں ںوا بھیک مانگی لیڈر آج باہر نکل لوگ اندھی نفرت بغض کینہ شکار حاسدین ٹولہ نظرانداز ملک حقیقی سیاسی قیادت بھروسہ ,2022-04-10 20:10:54
894,894,2,راولپنڈی لوگ سڑک پہ چھتہ پاکستان شہر سمیت دنیا بھر عمران خاں حق مظاہرے حالات م,2022-04-10 20:10:54
895,895,0,رنڈی بہیںچود دکھانا ,2022-04-10 20:10:54
896,896,3,اتنا احتجاج میڈیا دکھ ,2022-04-10 20:10:54
897,897,3,تحریک انصاف امیر غریب ,2022-04-10 20:10:54
898,898,5,حساب لوگ خان سپورٹ باہر عاشقان جی ایچ کیو تحریک لبیک جلدی آڈر مل ,2022-04-10 20:10:54
899,899,0,ادارہ ہوش ناخن ملک خانہ جھنگی الیکشن جایں عوام چور برداشت ا,2022-04-10 20:10:54
900,900,0,حسینی حسین ڈٹ مقابلہ روک روک امپورٹڈحکومتنامنظور,2022-04-10 20:10:54
901,901,3,اتنا احتجاج میڈیا دکھ ,2022-04-10 20:10:54
902,902,3,لاہور لبرٹی مارکیٹ پسندیدہ ہوٹل سینڈوچ منگوانا راستہ بند سوشل میڈیا دیکھ دنگ,2022-04-10 20:10:55
903,903,1,لوگ باہر لوگ نکل جلسا ملک باہر بغیر لیڈر خود خان باہرایگا حال نام شر,2022-04-10 20:10:55
